{
  "schema_version": 1,
  "mode": "proxy-split",
  "tun": { "prefix": "172.19.0.0/30", "stack": "system" },
  "interface_a": { "guid": "{11111111-1111-1111-1111-111111111111}", "bind_interface": "WLAN" },
  "interface_b": { "guid": "{22222222-2222-2222-2222-222222222222}", "bind_interface": "Ethernet" },
  "direct_prefixes": [],
  "domestic": { "cidrs": ["1.0.1.0/24"], "domain_suffixes": ["example.cn"] },
  "dns": {
    "domestic": { "type": "udp", "server": "223.5.5.5", "port": 53 },
    "global": { "type": "udp", "server": "8.8.8.8", "port": 53 }
  },
  "proxy": { "type": "http", "server": "203.0.113.10", "port": 8080 },
  "ipv6": "block"
}
